{
  "schema_version": "2.0",
  "feature_version": "shoulder-relative-deltas-v1",
  "baseline_id": "00000000-0000-4000-8000-000000000001",
  "sequence": 0,
  "start_ms": 0,
  "end_ms": 1000,
  "phase": "running",
  "measurement_quality": "good",
  "features": {
    "head_gap_delta": 0.0,
    "lateral_offset_delta": 0.2,
    "shoulder_tilt_delta": 0.0,
    "current_quality": 0.9,
    "baseline_quality": 0.8
  }
}
